{
  "$schema": "./data-inventory.schema.json",
  "version": "1.0.0",
  "updated": "2026-04-28",
  "owner": "Privacy Lead",
  "tiers": ["Public", "Internal", "Confidential", "Restricted"],
  "dataStores": [
    {
      "id": "nzila-staging-db",
      "name": "Nzila Staging Postgres",
      "kind": "postgres",
      "host": "nzila-staging-db (Azure PostgreSQL Flexible, Canada Central)",
      "owner": "Platform Lead",
      "environment": "staging",
      "highestDataTier": "Confidential",
      "personalData": true,
      "categories": ["account", "session", "operational", "AI inputs/outputs"],
      "retention": "see governance/privacy/policies/retention-schedule.md",
      "encryption": "at-rest (Azure-managed) + TLS in transit",
      "lawfulBasis": ["contract", "legitimate interest"],
      "crossBorder": false,
      "subProcessors": ["Microsoft Azure (Canada Central)"],
      "linkedSurfaces": []
    },
    {
      "id": "nzilacanadastore",
      "name": "Nzila Canada Storage",
      "kind": "azure-blob",
      "host": "nzilacanadastore (Azure Storage, Canada Central)",
      "owner": "Platform Lead",
      "environment": "staging",
      "highestDataTier": "Confidential",
      "personalData": true,
      "categories": ["documents", "exports", "media", "evidence", "backups"],
      "retention": "container-specific; see governance/privacy/policies/retention-schedule.md",
      "encryption": "at-rest (Azure-managed) + TLS in transit",
      "lawfulBasis": ["contract"],
      "crossBorder": false,
      "subProcessors": ["Microsoft Azure (Canada Central)"]
    },
    {
      "id": "azure-openai-eastus",
      "name": "Azure OpenAI (East US)",
      "kind": "ai-provider",
      "host": "https://eastus.api.cognitive.microsoft.com/",
      "owner": "AI Lead",
      "environment": "staging",
      "highestDataTier": "Confidential",
      "personalData": true,
      "categories": ["AI inference inputs", "AI inference outputs"],
      "retention": "zero-retention per Azure DPA",
      "encryption": "TLS in transit",
      "lawfulBasis": ["legitimate interest"],
      "crossBorder": true,
      "transferMechanism": "Microsoft DPA + SCCs",
      "subProcessors": ["Microsoft Azure"],
      "linkedSurfaces": ["console-ai", "console-ai-actions", "union-eyes-triage"]
    },
    {
      "id": "azure-openai-eastus2-whisper",
      "name": "Azure OpenAI Whisper (East US 2)",
      "kind": "ai-provider",
      "host": "https://eastus2.api.cognitive.microsoft.com/",
      "owner": "AI Lead",
      "environment": "staging",
      "highestDataTier": "Restricted",
      "personalData": true,
      "categories": ["voice audio", "transcripts"],
      "retention": "zero-retention per Azure DPA",
      "encryption": "TLS in transit",
      "lawfulBasis": ["consent"],
      "crossBorder": true,
      "transferMechanism": "Microsoft DPA + SCCs",
      "subProcessors": ["Microsoft Azure"],
      "linkedSurfaces": ["zonga-voice"]
    },
    {
      "id": "nzila-staging-kv",
      "name": "Nzila Staging Key Vault",
      "kind": "azure-keyvault",
      "host": "nzila-staging-kv (Canada Central)",
      "owner": "Security Lead",
      "environment": "staging",
      "highestDataTier": "Restricted",
      "personalData": false,
      "categories": ["secrets", "keys"],
      "retention": "until rotation",
      "encryption": "Azure-managed HSM-backed",
      "lawfulBasis": ["contract"],
      "crossBorder": false,
      "subProcessors": ["Microsoft Azure (Canada Central)"]
    }
  ]
}
